{
  "provider": "azure",
  "adapter_package": "azure-network-mcp",
  "adapter_version": "0.2.0",
  "contract_version": "1.0.0",
  "min_supported_contract_version": "1.0.0",
  "urn_grammar_version": 1,
  "supported_resource_types": [
    {
      "resource_type": "network",
      "export_tool": "azure_get_virtual_network",
      "exact_mapping": true,
      "notes": null
    },
    {
      "resource_type": "subnet",
      "export_tool": "azure_get_subnets",
      "exact_mapping": true,
      "notes": null
    },
    {
      "resource_type": "network-interface",
      "export_tool": "azure_get_network_interfaces",
      "exact_mapping": true,
      "notes": null
    },
    {
      "resource_type": "address",
      "export_tool": "azure_get_public_ip_addresses",
      "exact_mapping": true,
      "notes": null
    },
    {
      "resource_type": "route-table",
      "export_tool": "azure_get_route_tables",
      "exact_mapping": true,
      "notes": null
    },
    {
      "resource_type": "route",
      "export_tool": "azure_get_effective_routes",
      "exact_mapping": true,
      "notes": "Sourced from NetworkInterfacesOperations.begin_get_effective_route_table, not the raw RouteTable.routes list, so priority is always null (Azure has no route-level priority field)."
    },
    {
      "resource_type": "firewall-rule",
      "export_tool": "azure_get_nsg_security_rules",
      "exact_mapping": true,
      "notes": "Always stateful=true -- Azure NSGs have no stateless equivalent to an AWS NACL."
    },
    {
      "resource_type": "transit-hub",
      "export_tool": "azure_get_virtual_hubs",
      "exact_mapping": true,
      "notes": null
    },
    {
      "resource_type": "attachment",
      "export_tool": "azure_get_hub_virtual_network_connections",
      "exact_mapping": true,
      "notes": null
    },
    {
      "resource_type": "peering",
      "export_tool": "azure_get_virtual_network_peerings",
      "exact_mapping": true,
      "notes": null
    },
    {
      "resource_type": "vpn-gateway",
      "export_tool": "azure_get_vpn_gateways",
      "exact_mapping": true,
      "notes": "Covers vWAN-scoped VpnGateway; classic VirtualNetworkGateway is mapped through the same tool."
    },
    {
      "resource_type": "vpn-tunnel",
      "export_tool": "azure_get_vpn_connections",
      "exact_mapping": true,
      "notes": "redacted=true always -- no pre-shared-key-bearing field is ever read from the Azure SDK response."
    },
    {
      "resource_type": "interconnect",
      "export_tool": "azure_get_expressroute_circuits",
      "exact_mapping": true,
      "notes": "redacted=true always -- no authorization/service-key field is ever read from the Azure SDK response."
    },
    {
      "resource_type": "interconnect-attachment",
      "export_tool": "azure_get_expressroute_circuit_peerings",
      "exact_mapping": true,
      "notes": "redacted=true always -- shared_key is never read from the Azure SDK response."
    },
    {
      "resource_type": "dns-zone",
      "export_tool": "azure_get_private_dns_zones",
      "exact_mapping": true,
      "notes": null
    },
    {
      "resource_type": "dns-resolver",
      "export_tool": "azure_get_dns_resolver_endpoints",
      "exact_mapping": false,
      "notes": "One canonical record per inbound/outbound endpoint, not per top-level DnsResolver resource (direction/ip_addresses are endpoint-scoped facts)."
    },
    {
      "resource_type": "dns-rule",
      "export_tool": "azure_get_dns_forwarding_rules",
      "exact_mapping": true,
      "notes": null
    },
    {
      "resource_type": "load-balancer",
      "export_tool": "azure_get_load_balancers",
      "exact_mapping": false,
      "notes": "Also covers ApplicationGateway via the same canonical shape (lb_type=application); listener_ports for an ApplicationGateway is synthesized from its listeners' frontend ports."
    },
    {
      "resource_type": "endpoint",
      "export_tool": "azure_get_private_endpoints",
      "exact_mapping": true,
      "notes": "endpoint_type=consumer for PrivateEndpoint, endpoint_type=producer for PrivateLinkService."
    },
    {
      "resource_type": "observability-reference",
      "export_tool": "azure_get_flow_logs",
      "exact_mapping": true,
      "notes": "Also covers ConnectionMonitor via the same canonical shape (observability_type=connection-monitor)."
    }
  ],
  "supports_topology": true,
  "supports_diagnostics": true,
  "supports_observability": true,
  "generated_at": "2026-08-28T12:00:00Z"
}
